<?xml version="1.0" encoding="UTF-8"?>
<airports xmlns:xsi="http://www.w3.org/2001/XMLSchema-instance"
          xsi:noNamespaceSchemaLocation="airports.xsd">
  <airport>
    <code>ABZ</code>
    <name>Aberdeen International Airport</name>
    <group>UK</group>
  </airport>
  <airport>
    <code>ACI</code>
    <name>Alderney Airport</name>
    <group>Channel Islands</group>
  </airport>
  <airport>
    <code>BAG</code>
    <name>Bagshot Intercontinental Airport</name>
    <group>Legacy placeholders</group>
    <note>Code/name may be non-standard</note>
  </airport>
  <airport>
    <code>BFS</code>
    <name>Belfast International Airport</name>
    <group>UK</group>
  </airport>
  <airport>
    <code>BHX</code>
    <name>Birmingham Airport</name>
    <group>UK</group>
  </airport>
  <airport>
    <code>BRS</code>
    <name>Bristol Airport</name>
    <group>UK</group>
  </airport>
  <airport>
    <code>GCM</code>
    <name>Cayman Islands Airport Authority</name>
    <group>Other</group>
    <note>Name appears to be an authority, not a single airport. British Overseas Territory</note>
  </airport>
  <airport>
    <code>NQY</code>
    <name>Cornwall Airport Newquay</name>
    <group>UK</group>
  </airport>
  <airport>
    <code>DSA</code>
    <name>Doncaster Sheffield Airport</name>
    <group>UK</group>
  </airport>
  <airport>
    <code>EMA</code>
    <name>East Midlands Airport</name>
    <group>UK</group>
  </airport>
  <airport>
    <code>EDI</code>
    <name>Edinburgh Airport</name>
    <group>UK</group>
  </airport>
  <airport>
    <code>FAB</code>
    <name>Farnborough Airport Limited</name>
    <group>UK</group>
  </airport>
  <airport>
    <code>GLA</code>
    <name>Glasgow International Airport</name>
    <group>UK</group>
  </airport>
  <airport>
    <code>GCI</code>
    <name>Guernsey Airport</name>
    <group>Channel Islands</group>
  </airport>
  <airport>
    <code>CEG</code>
    <name>Hawarden Airport</name>
    <group>UK</group>
  </airport>
  <airport>
    <code>HUY</code>
    <name>Humberside Airport</name>
    <group>UK</group>
  </airport>
  <airport>
    <code>IOM</code>
    <name>Isle of Man Airport</name>
    <group>Isle of Man</group>
  </airport>
  <airport>
    <code>JER</code>
    <name>Jersey Airport</name>
    <group>Channel Islands</group>
  </airport>
  <airport>
    <code>LBA</code>
    <name>Leeds Bradford Airport</name>
    <group>UK</group>
  </airport>
  <airport>
    <code>LPL</code>
    <name>Liverpool John Lennon Airport</name>
    <group>UK</group>
  </airport>
  <airport>
    <code>LPL OLD</code>
    <name>Liverpool John Lennon Airport OLD</name>
    <group>Legacy placeholders</group>
    <note>Non-IATA format (contains space)</note>
  </airport>
  <airport>
    <code>LCY</code>
    <name>London City Airport</name>
    <group>UK</group>
  </airport>
  <airport>
    <code>LGW</code>
    <name>London Gatwick Airport</name>
    <group>UK</group>
  </airport>
  <airport>
    <code>LHR</code>
    <name>London Heathrow Airport</name>
    <group>UK</group>
  </airport>
  <airport>
    <code>LTN</code>
    <name>London Luton Airport</name>
    <group>UK</group>
  </airport>
  <airport>
    <code>SEN</code>
    <name>London Southend Airport</name>
    <group>UK</group>
  </airport>
  <airport>
    <code>STN</code>
    <name>London Stansted Airport</name>
    <group>UK</group>
  </airport>
  <airport>
    <code>MAN</code>
    <name>Manchester Airport</name>
    <group>UK</group>
  </airport>
  <airport>
    <code>NCL</code>
    <name>Newcastle International Airport</name>
    <group>UK</group>
  </airport>
  <airport>
    <code>XXXX</code>
    <name>Old East Midlands Airprot</name>
    <group>Legacy placeholders</group>
    <note>Likely placeholder / non-IATA</note>
  </airport>
  <airport>
    <code>XLCY</code>
    <name>Old London City Airport</name>
    <group>Legacy placeholders</group>
    <note>Likely placeholder / non-IATA</note>
  </airport>
  <airport>
    <code>XXX</code>
    <name>Old Stansted</name>
    <group>Legacy placeholders</group>
    <note>Likely placeholder / non-IATA</note>
  </airport>
  <airport>
    <code>SOU</code>
    <name>Southampton International Airport</name>
    <group>UK</group>
  </airport>
  <airport>
    <code>BDA</code>
    <name>Bermuda L.F. Wade International Airport</name>
    <group>Other</group>
    <note>British Overseas Territory</note>
  </airport>
</airports>
